Kenya,Primary Health Care (PHC) Expenditure as % Current Health Expenditure (CHE),0,0,0,0,0,0,0,0,0,0,0,0,0,0,0,0,0,66,68,66,64,0,0,0,0,0,0,0,0,0
Kenya,Domestic General Government Expenditure on PHC per Capita in US$,0,0,0,0,0,0,0,0,0,0,0,0,0,0,0,0,0,19,17,18,21,0,0,0,0,0,0,0,0,0
Kenya,Domestic General Government Expenditure on PHC as % GGHE-D,0,0,0,0,0,0,0,0,0,0,0,0,0,0,0,0,0,58,58,56,52,0,0,0,0,0,0,0,0,0
Kenya,Domestic General Government Expenditure on PHC as % PHC,0,0,0,0,0,0,0,0,0,0,0,0,0,0,0,0,0,38,37,36,38,0,0,0,0,0,0,0,0,0
Kenya,External Expenditure on PHC per Capita in US$,0,0,0,0,0,0,0,0,0,0,0,0,0,0,0,0,0,12,14,16,15,0,0,0,0,0,0,0,0,0
Kenya,External Expenditure on PHC as % EXT,0,0,0,0,0,0,0,0,0,0,0,0,0,0,0,0,0,97,97,94,94,0,0,0,0,0,0,0,0,0
Kenya,External Expenditure on PHC as % PHC,0,0,0,0,0,0,0,0,0,0,0,0,0,0,0,0,0,24,30,31,27,0,0,0,0,0,0,0,0,0
Kenya,PHC (government and donors) as % of GDP,0,0,0,0,0,0,0,0,0,0,0,0,0,0,0,0,0,2,2,2,2,0,0,0,0,0,0,0,0,0
Kenya,Domestic Private Expenditure on PHC per Capita in US$,0,0,0,0,0,0,0,0,0,0,0,0,0,0,0,0,0,19,15,16,19,0,0,0,0,0,0,0,0,0
Kenya,Domestic Private Expenditure on PHC as % PVTD,0,0,0,0,0,0,0,0,0,0,0,0,0,0,0,0,0,62,63,62,63,0,0,0,0,0,0,0,0,0
Kenya,Domestic Private Expenditure on PHC as % PHC,0,0,0,0,0,0,0,0,0,0,0,0,0,0,0,0,0,39,33,33,35,0,0,0,0,0,0,0,0,0
Kenya,Expenditure on Immunization Programmes as % Current Health Expenditure (CHE),0,0,0,0,0,0,0,0,0,0,0,0,0,0,0,0,0,0,0,1,1,0,0,0,0,0,0,0,0,0
Kenya,Domestic General Government Expenditure on Immunization Programmes as % of Domestic General Government Expenditure on Health (GGHE-D),0,0,0,0,0,0,0,0,0,0,0,0,0,0,0,0,0,0,0,0,0,0,0,0,0,0,0,0,0,0
Kenya,External sources of funding on Immunization Programmes as % of External Health Expenditure (EXT),0,0,0,0,0,0,0,0,0,0,0,0,0,0,0,0,0,1,1,3,3,0,0,0,0,0,0,0,0,0
Kenya,Expenditure on Infectious and Parasitic Diseases as % of Current Health Expenditure (CHE),0,0,0,0,0,0,0,0,0,0,0,0,0,0,0,0,0,0,55,53,51,0,0,0,0,0,0,0,0,0
Kenya,Expenditure on HIV/AIDS and Sexually Transmitted Diseases (STDs) as % of Current Health Expenditure (CHE),0,0,0,0,0,0,0,0,0,0,0,0,0,0,0,0,0,0,23,22,19,0,0,0,0,0,0,0,0,0
Kenya,Expenditure on Tuberculosis (TB) as % of Current Health Expenditure (CHE),0,0,0,0,0,0,0,0,0,0,0,0,0,0,0,0,0,0,2,3,2,0,0,0,0,0,0,0,0,0
Kenya,Expenditure on Malaria as % of Current Health Expenditure (CHE),0,0,0,0,0,0,0,0,0,0,0,0,0,0,0,0,0,0,7,7,7,0,0,0,0,0,0,0,0,0
Kenya,Expenditure on Neglected Tropical Diseases (NTDs) as % of Current Health Expenditure (CHE),0,0,0,0,0,0,0,0,0,0,0,0,0,0,0,0,0,0,0,0,0,0,0,0,0,0,0,0,0,0
Kenya,Expenditure on Reproductive Health as % of Current Health Expenditure (CHE),0,0,0,0,0,0,0,0,0,0,0,0,0,0,0,0,0,0,16,19,20,0,0,0,0,0,0,0,0,0
Kenya,Expenditure on Maternal Conditions as % of Current Health Expenditure (CHE),0,0,0,0,0,0,0,0,0,0,0,0,0,0,0,0,0,0,12,13,14,0,0,0,0,0,0,0,0,0
Kenya,Expenditure on Perinatal Conditions as % of Current Health Expenditure (CHE),0,0,0,0,0,0,0,0,0,0,0,0,0,0,0,0,0,0,2,2,2,0,0,0,0,0,0,0,0,0
Kenya,Expenditure on Contraceptive Management (Family Planning) as % of Current Health Expenditure (CHE),0,0,0,0,0,0,0,0,0,0,0,0,0,0,0,0,0,0,2,3,3,0,0,0,0,0,0,0,0,0
Kenya,Expenditure on Nutritional Deficiencies as % of Current Health Expenditure (CHE),0,0,0,0,0,0,0,0,0,0,0,0,0,0,0,0,0,0,5,5,5,0,0,0,0,0,0,0,0,0
Kenya,Expenditure on Noncommunicable Diseases (NCDs) as % of Current Health Expenditure (CHE),0,0,0,0,0,0,0,0,0,0,0,0,0,0,0,0,0,0,12,12,12,0,0,0,0,0,0,0,0,0
Kenya,Expenditure on Injuries as % of Current Health Expenditure (CHE),0,0,0,0,0,0,0,0,0,0,0,0,0,0,0,0,0,0,3,3,3,0,0,0,0,0,0,0,0,0
Kenya,Expenditure on other and unspecified diseases/conditions (n.e.c.) as % of Current Health Expenditure (CHE),0,0,0,0,0,0,0,0,0,0,0,0,0,0,0,0,0,0,8,8,9,0,0,0,0,0,0,0,0,0
Kenya,Domestic General Government Expenditure on Infectious and Parasitic Diseases as % of Domestic General Government Expenditure on Health (GGHE-D),0,0,0,0,0,0,0,0,0,0,0,0,0,0,0,0,0,0,48,47,44,0,0,0,0,0,0,0,0,0
Kenya,Domestic General Government Expenditure on HIV/AIDS and Sexually Transmitted Diseases (STDs) as % of Domestic General Government Expenditure on Health (GGHE-D),0,0,0,0,0,0,0,0,0,0,0,0,0,0,0,0,0,0,12,14,10,0,0,0,0,0,0,0,0,0
Kenya,Domestic General Government Expenditure on Tuberculosis (TB) as % of Domestic General Government Expenditure on Health (GGHE-D),0,0,0,0,0,0,0,0,0,0,0,0,0,0,0,0,0,0,2,2,2,0,0,0,0,0,0,0,0,0
Kenya,Domestic General Government Expenditure on Malaria as % of Domestic General Government Expenditure on Health (GGHE-D),0,0,0,0,0,0,0,0,0,0,0,0,0,0,0,0,0,0,7,6,6,0,0,0,0,0,0,0,0,0
Kenya,Domestic General Government Expenditure on Reproductive Health as % of Domestic General Government Expenditure on Health (GGHE-D),0,0,0,0,0,0,0,0,0,0,0,0,0,0,0,0,0,0,13,17,20,0,0,0,0,0,0,0,0,0
Kenya,Domestic General Government Expenditure on Maternal Conditions as % of Domestic General Government Expenditure on Health (GGHE-D),0,0,0,0,0,0,0,0,0,0,0,0,0,0,0,0,0,0,10,13,15,0,0,0,0,0,0,0,0,0
Kenya,Domestic General Government Expenditure on Perinatal Conditions as % of Domestic General Government Expenditure on Health (GGHE-D),0,0,0,0,0,0,0,0,0,0,0,0,0,0,0,0,0,0,1,2,3,0,0,0,0,0,0,0,0,0
Kenya,Domestic General Government Expenditure on Contraceptive Management (Family Planning) as % of Domestic General Government Expenditure on Health (GGHE-D),0,0,0,0,0,0,0,0,0,0,0,0,0,0,0,0,0,0,2,2,2,0,0,0,0,0,0,0,0,0
Kenya,Domestic General Government Expenditure on Nutritional Deficiencies as % of Domestic General Government Expenditure on Health (GGHE-D),0,0,0,0,0,0,0,0,0,0,0,0,0,0,0,0,0,0,3,3,3,0,0,0,0,0,0,0,0,0
Kenya,Domestic General Government Expenditure on Noncommunicable Diseases (NCDs) as % of Domestic General Government Expenditure on Health (GGHE-D),0,0,0,0,0,0,0,0,0,0,0,0,0,0,0,0,0,0,16,14,15,0,0,0,0,0,0,0,0,0
Kenya,Domestic General Government Expenditure on Injuries as % of Domestic General Government Expenditure on Health (GGHE-D),0,0,0,0,0,0,0,0,0,0,0,0,0,0,0,0,0,0,4,4,4,0,0,0,0,0,0,0,0,0
Kenya,Domestic General Government Expenditure on other and unspecified diseases/conditions (n.e.c.) as % of Domestic General Government Expenditure on Health (GGHE-D),0,0,0,0,0,0,0,0,0,0,0,0,0,0,0,0,0,0,15,15,14,0,0,0,0,0,0,0,0,0
Kenya,External sources of funding on Infectious and Parasitic Diseases as % of External Health Expenditure (EXT),0,0,0,0,0,0,0,0,0,0,0,0,0,0,0,0,0,0,87,80,81,0,0,0,0,0,0,0,0,0
Kenya,External sources of funding on HIV/AIDS and Sexually Transmitted Diseases (STDs) as % of External Health Expenditure (EXT),0,0,0,0,0,0,0,0,0,0,0,0,0,0,0,0,0,0,78,60,68,0,0,0,0,0,0,0,0,0
Kenya,External sources of funding on Tuberculosis (TB) as % of External Health Expenditure (EXT),0,0,0,0,0,0,0,0,0,0,0,0,0,0,0,0,0,0,4,6,3,0,0,0,0,0,0,0,0,0
Kenya,External sources of funding on Malaria as % of External Health Expenditure (EXT),0,0,0,0,0,0,0,0,0,0,0,0,0,0,0,0,0,0,4,9,5,0,0,0,0,0,0,0,0,0
Kenya,External sources of funding on Neglected Tropical Diseases (NTDs) as % of External Health Expenditure (EXT),0,0,0,0,0,0,0,0,0,0,0,0,0,0,0,0,0,0,0,0,0,0,0,0,0,0,0,0,0,0
Kenya,External sources of funding on Reproductive Health as % of External Health Expenditure (EXT),0,0,0,0,0,0,0,0,0,0,0,0,0,0,0,0,0,0,2,11,8,0,0,0,0,0,0,0,0,0
Kenya,External sources of funding on Maternal Conditions as % of External Health Expenditure (EXT),0,0,0,0,0,0,0,0,0,0,0,0,0,0,0,0,0,0,1,0,1,0,0,0,0,0,0,0,0,0
Kenya,External sources of funding on Perinatal Conditions as % of External Health Expenditure (EXT),0,0,0,0,0,0,0,0,0,0,0,0,0,0,0,0,0,0,0,0,0,0,0,0,0,0,0,0,0,0
Kenya,External sources of funding on Contraceptive Management (Family Planning) as % of External Health Expenditure (EXT),0,0,0,0,0,0,0,0,0,0,0,0,0,0,0,0,0,0,0,1,1,0,0,0,0,0,0,0,0,0
Kenya,External sources of funding on Nutritional Deficiencies as % of External Health Expenditure (EXT),0,0,0,0,0,0,0,0,0,0,0,0,0,0,0,0,0,0,2,3,2,0,0,0,0,0,0,0,0,0
Kenya,External sources of funding on Noncommunicable Diseases (NCDs) as % of External Health Expenditure (EXT),0,0,0,0,0,0,0,0,0,0,0,0,0,0,0,0,0,0,5,4,2,0,0,0,0,0,0,0,0,0
Kenya,External sources of funding on Injuries as % of External Health Expenditure (EXT),0,0,0,0,0,0,0,0,0,0,0,0,0,0,0,0,0,0,0,0,0,0,0,0,0,0,0,0,0,0
Kenya,External sources of funding on other and unspecified diseases/conditions (n.e.c.) as % of External Health Expenditure (EXT),0,0,0,0,0,0,0,0,0,0,0,0,0,0,0,0,0,0,3,2,7,0,0,0,0,0,0,0,0,0
Kenya,General Government Expenditure (GGE) as % Gross Domestic Product (GDP),0,14,15,16,16,15,16,17,18,19,20,22,20,22,23,23,24,25,25,24,24,25,24,0,0,0,0,0,0,0
Kenya,Gross Domestic Product (GDP) per Capita in US$,0,590,588,581,633,655,734,803,965,"1,048","1,049","1,094","1,099","1,290","1,377","1,490","1,497","1,562","1,676","1,846","1,970","1,936","2,082",0,0,0,0,0,0,0
Kenya,Current health expenditure by revenues of health care financing schemes,Million NCU,"50,303","55,315","57,650","65,929","76,443","84,325","109,366","129,018","150,221","172,618","193,858","216,539","239,220","261,902","294,949","327,996","361,044","338,146","382,862","447,260","479,674","550,182",0,0,0,0,0,0,0
Kenya,Transfers from government domestic revenue (allocated to health purposes),Million NCU,"11,927","13,390","14,311","15,872","17,008","19,708","22,594","27,255","32,782","40,523","47,292","56,983","66,675","76,366","92,938","109,511","126,731","142,273","160,046","199,335","230,082","260,829",0,0,0,0,0,0,0
Kenya,Internal transfers and grants,Million NCU,"11,927","13,390","14,311","15,872","17,008","19,708","22,594","27,255","32,782","40,523","47,292","56,983","66,675","76,366","92,938","109,511","126,083","103,954","117,485","137,113","158,262","179,411",0,0,0,0,0,0,0
Kenya,Transfers by government on behalf of specific groups,Million NCU,0,0,0,0,0,0,0,0,0,0,0,0,0,0,0,0,648,"31,903","42,561","55,442","63,994","72,546",0,0,0,0,0,0,0
Kenya,Subsidies,Million NCU,0,0,0,0,0,0,0,0,0,0,0,0,0,0,0,0,0,0,0,0,0,0,0,0,0,0,0,0,0
Kenya,Other transfers from government domestic revenue,Million NCU,0,0,0,0,0,0,0,0,0,0,0,0,0,0,0,0,0,"6,417",0,"6,780","7,826","8,872",0,0,0,0,0,0,0
Kenya,Transfers distributed by government from foreign origin,Million NCU,"5,386","5,946","6,252","6,148","6,563","5,417","4,082","5,009","5,070","2,917","4,606","5,107","8,479","12,955","15,742","19,634","23,526","12,010","21,443","13,101","33,736","56,001",0,0,0,0,0,0,0
Kenya,Social insurance contributions,Million NCU,"1,929","2,166","2,315","2,395","2,474","2,553","2,633","4,188","5,743","7,298","8,853","9,852","10,852","11,851","17,393","22,936","27,830","2,926","5,004","6,311","6,713","7,293",0,0,0,0,0,0,0
Kenya,"Compulsory prepayment (Other, and unspecified, than FS.3)",Million NCU,0,0,0,0,0,0,0,0,0,0,0,0,0,0,0,0,0,0,0,0,0,0,0,0,0,0,0,0,0
Kenya,Voluntary prepayment,Million NCU,"2,043","2,212","2,218","2,626","3,034","3,442","3,849","6,042","8,234","10,426","12,619","15,996","19,373","22,750","28,005","33,260","38,515","40,890","33,625","43,749","44,733","50,424",0,0,0,0,0,0,0
Kenya,Other domestic revenues n.e.c.,Million NCU,"27,421","29,694","29,773","34,041","38,382","42,761","47,258","52,623","58,129","63,744","69,253","76,709","84,165","91,621","97,566","103,511","109,456","80,754","99,365","112,913","115,541","130,249",0,0,0,0,0,0,0
Kenya,Other revenues from households n.e.c.,Million NCU,"23,538","25,489","25,557","29,675","33,793","37,912","42,030","46,149","50,267","54,385","58,504","67,054","75,604","84,154","86,189","88,224","90,260","78,722","89,456","108,683","111,126","125,266",0,0,0,0,0,0,0
Kenya,Other revenues from corporations n.e.c.,Million NCU,"2,097","2,270","2,277","2,286","2,296","2,305","2,315","3,169","4,023","4,877","5,731","3,978","2,225",472,"3,697","6,921","10,146","1,480","9,302","3,736","3,911","4,415",0,0,0,0,0,0,0
Kenya,Other revenues from NPISH n.e.c.,Million NCU,"1,786","1,934","1,939","2,080","2,293","2,544","2,913","3,305","3,839","4,482","5,019","5,677","6,336","6,995","7,680","8,365","9,050",551,607,493,504,568,0,0,0,0,0,0,0
Kenya,Unspecified other domestic revenues (n.e.c.),Million NCU,0,0,0,0,0,0,0,0,0,0,0,0,0,0,0,0,0,0,0,1,0,0,0,0,0,0,0,0,0
Kenya,Direct foreign transfers,Million NCU,"1,597","1,907","2,780","4,848","8,981","10,446","28,949","33,902","40,264","47,710","51,234","51,891","49,677","46,359","43,304","39,145","34,986","59,294","63,380","69,687","48,868","45,386",0,0,0,0,0,0,0
Kenya,Unspecified revenues of health care financing schemes (n.e.c.),Million NCU,0,0,0,0,0,0,0,0,0,0,0,0,0,0,0,0,0,0,0,"2,164",0,0,0,0,0,0,0,0,0
Kenya,Current health expenditure by financing schemes,Million NCU,"50,303","55,315","57,650","65,929","76,443","84,325","109,366","129,018","150,221","172,618","193,858","216,539","239,220","261,902","294,949","327,996","361,044","338,146","382,862","447,260","479,674","550,182",0,0,0,0,0,0,0
Kenya,Government schemes and compulsory contributory health care financing schemes,Million NCU,"19,242","21,502","22,879","24,414","26,046","27,677","29,309","36,452","43,595","50,738","57,881","71,943","86,005","100,067","126,074","152,080","178,087","150,792","186,493","211,967","262,705","315,250",0,0,0,0,0,0,0
Kenya,Government schemes,Million NCU,"17,312","19,336","20,563","22,019","23,572","25,124","26,676","32,264","37,852","43,440","49,028","62,091","75,153","88,216","108,681","129,145","149,609","115,964","138,928","150,214","191,998","235,412",0,0,0,0,0,0,0
Kenya,Compulsory contributory health insurance schemes,Million NCU,"1,929","2,166","2,315","2,395","2,474","2,553","2,633","4,188","5,743","7,298","8,853","9,852","10,852","11,851","17,393","22,936","28,478","34,828","47,565","61,753","70,707","79,839",0,0,0,0,0,0,0
Kenya,Social health insurance schemes,Million NCU,"1,929","2,166","2,315","2,395","2,474","2,553","2,633","4,188","5,743","7,298","8,853","9,852","10,852","11,851","17,393","22,936","28,478","34,828","47,565","61,753","70,707","79,839",0,0,0,0,0,0,0
Kenya,Compulsory private insurance schemes,Million NCU,0,0,0,0,0,0,0,0,0,0,0,0,0,0,0,0,0,0,0,0,0,0,0,0,0,0,0,0,0
Kenya,Compulsory Medical Saving Accounts (CMSA),Million NCU,0,0,0,0,0,0,0,0,0,0,0,0,0,0,0,0,0,0,0,0,0,0,0,0,0,0,0,0,0
Kenya,Voluntary health care payment schemes,Million NCU,"7,523","8,324","9,215","11,839","16,604","18,736","38,027","46,417","56,360","67,494","77,474","77,542","77,611","77,680","82,686","87,691","92,697","108,631","106,914","126,610","105,842","109,666",0,0,0,0,0,0,0
Kenya,Voluntary health insurance schemes,Million NCU,"2,043","2,212","2,218","2,626","3,034","3,442","3,849","6,042","8,234","10,426","12,619","15,996","19,373","22,750","28,005","33,260","38,515","40,890","33,625","43,749","44,733","50,424",0,0,0,0,0,0,0
Kenya,NPISH financing schemes (including development agencies),Million NCU,"3,383","3,841","4,720","6,927","11,274","12,989","31,863","36,148","41,985","49,015","54,889","52,733","50,577","48,420","46,959","45,497","44,036","66,262","63,987","79,125","57,199","54,826",0,0,0,0,0,0,0
Kenya,Enterprise financing schemes,Million NCU,"2,097","2,270","2,277","2,286","2,296","2,305","2,315","4,227","6,140","8,053","9,966","8,814","7,662","6,510","7,722","8,934","10,146","1,480","9,302","3,736","3,911","4,415",0,0,0,0,0,0,0
Kenya,Household out-of-pocket payments (OOPS),Million NCU,"23,538","25,489","25,557","29,675","33,793","37,912","42,030","46,149","50,267","54,385","58,504","67,054","75,604","84,154","86,189","88,224","90,260","78,722","89,456","108,683","111,126","125,266",0,0,0,0,0,0,0
Kenya,Current health expenditure by Health Care Functions,Million NCU,0,0,0,0,0,0,0,0,0,0,0,0,0,0,0,0,"361,044","338,146","382,862","447,260",0,0,0,0,0,0,0,0,0
Kenya,Curative care,Million NCU,0,0,0,0,0,0,0,0,0,0,0,0,0,0,0,0,"256,280","234,207","250,874","298,433",0,0,0,0,0,0,0,0,0
Kenya,Inpatient curative care,Million NCU,0,0,0,0,0,0,0,0,0,0,0,0,0,0,0,0,"102,133","89,744","100,968","128,545",0,0,0,0,0,0,0,0,0
Kenya,Day curative care,Million NCU,0,0,0,0,0,0,0,0,0,0,0,0,0,0,0,0,0,0,"3,356",0,0,0,0,0,0,0,0,0,0
Kenya,Outpatient curative care,Million NCU,0,0,0,0,0,0,0,0,0,0,0,0,0,0,0,0,"154,053","144,348","146,486","168,997",0,0,0,0,0,0,0,0,0
Kenya,General outpatient curative care,Million NCU,0,0,0,0,0,0,0,0,0,0,0,0,0,0,0,0,"153,878","144,177","145,944","165,518",0,0,0,0,0,0,0,0,0
Kenya,Dental outpatient curative care,Million NCU,0,0,0,0,0,0,0,0,0,0,0,0,0,0,0,0,4,3,0,13,0,0,0,0,0,0,0,0,0
Kenya,Specialised outpatient curative care,Million NCU,0,0,0,0,0,0,0,0,0,0,0,0,0,0,0,0,172,169,542,"3,458",0,0,0,0,0,0,0,0,0
Kenya,Unspecified outpatient curative care (n.e.c.),Million NCU,0,0,0,0,0,0,0,0,0,0,0,0,0,0,0,0,0,0,0,7,0,0,0,0,0,0,0,0,0
Kenya,Home-based curative care,Million NCU,0,0,0,0,0,0,0,0,0,0,0,0,0,0,0,0,94,115,64,890,0,0,0,0,0,0,0,0,0
Kenya,Rehabilitative care,Million NCU,0,0,0,0,0,0,0,0,0,0,0,0,0,0,0,0,"4,339","3,898","4,103","4,781",0,0,0,0,0,0,0,0,0
Kenya,Ancillary services (non-specified by function),Million NCU,0,0,0,0,0,0,0,0,0,0,0,0,0,0,0,0,"4,157","3,711","4,406","5,223",0,0,0,0,0,0,0,0,0
Kenya,Medical goods (non-specified by function),Million NCU,0,0,0,0,0,0,0,0,0,0,0,0,0,0,0,0,"5,970","4,945","5,432","6,343",0,0,0,0,0,0,0,0,0
Kenya,Pharmaceuticals and Other medical durable goods,Million NCU,0,0,0,0,0,0,0,0,0,0,0,0,0,0,0,0,"5,967","4,941","5,432","6,343",0,0,0,0,0,0,0,0,0
Kenya,Unspecified medical goods (n.e.c.),Million NCU,0,0,0,0,0,0,0,0,0,0,0,0,0,0,0,0,4,4,0,0,0,0,0,0,0,0,0,0,0
Kenya,Preventive care,Million NCU,0,0,0,0,0,0,0,0,0,0,0,0,0,0,0,0,"43,895","48,108","69,254","72,213",0,0,0,0,0,0,0,0,0
Kenya,"Information, education and counseling (IEC) programmes",Million NCU,0,0,0,0,0,0,0,0,0,0,0,0,0,0,0,0,"8,057","9,804","14,282","16,866",0,0,0,0,0,0,0,0,0
Kenya,Immunization Programmes,Million NCU,0,0,0,0,0,0,0,0,0,0,0,0,0,0,0,0,"1,092","1,259","2,922","2,997",0,0,0,0,0,0,0,0,0
Kenya,Early disease detection programmes,Million NCU,0,0,0,0,0,0,0,0,0,0,0,0,0,0,0,0,94,108,103,76,0,0,0,0,0,0,0,0,0
Kenya,Healthy condition monitoring programmes,Million NCU,0,0,0,0,0,0,0,0,0,0,0,0,0,0,0,0,"15,392","15,225","17,780","21,039",0,0,0,0,0,0,0,0,0
Kenya,Epidemiological surveillance and risk and disease control programmes,Million NCU,0,0,0,0,0,0,0,0,0,0,0,0,0,0,0,0,"2,366","2,475","5,566","16,577",0,0,0,0,0,0,0,0,0
Kenya,Preparing for disaster and emergency response programmes,Million NCU,0,0,0,0,0,0,0,0,0,0,0,0,0,0,0,0,"1,911","1,796",0,0,0,0,0,0,0,0,0,0,0
Kenya,Unspecified preventive care (n.e.c.),Million NCU,0,0,0,0,0,0,0,0,0,0,0,0,0,0,0,0,"14,983","17,441","28,602","14,658",0,0,0,0,0,0,0,0,0
Kenya,"Governance, and health system and financing administration",Million NCU,0,0,0,0,0,0,0,0,0,0,0,0,0,0,0,0,"46,402","43,277","43,305","52,371",0,0,0,0,0,0,0,0,0
Kenya,Governance and Health system administration,Million NCU,0,0,0,0,0,0,0,0,0,0,0,0,0,0,0,0,"2,646","3,224","1,956","6,115",0,0,0,0,0,0,0,0,0
Kenya,Administration of health financing,Million NCU,0,0,0,0,0,0,0,0,0,0,0,0,0,0,0,0,"43,756","40,052","39,463","46,058",0,0,0,0,0,0,0,0,0
Kenya,"Unspecified governance, and health system and financing administration (n.e.c.)",Million NCU,0,0,0,0,0,0,0,0,0,0,0,0,0,0,0,0,0,0,"1,887",197,0,0,0,0,0,0,0,0,0
Kenya,Other health care services not elsewhere classified (n.e.c.),Million NCU,0,0,0,0,0,0,0,0,0,0,0,0,0,0,0,0,0,0,"5,488","7,897",0,0,0,0,0,0,0,0,0
Kenya,Domestic general government health expenditure by Health Care Functions,Million NCU,0,0,0,0,0,0,0,0,0,0,0,0,0,0,0,0,"154,561","145,199","165,050","205,646",0,0,0,0,0,0,0,0,0
Kenya,Domestic General Government Expenditure on Curative care,Million NCU,0,0,0,0,0,0,0,0,0,0,0,0,0,0,0,0,"99,612","93,578","106,010","135,682",0,0,0,0,0,0,0,0,0
Kenya,Domestic General Government Expenditure on Inpatient curative care,Million NCU,0,0,0,0,0,0,0,0,0,0,0,0,0,0,0,0,"56,886","53,440","60,651","83,120",0,0,0,0,0,0,0,0,0
Kenya,Domestic General Government Expenditure on Outpatient curative care,Million NCU,0,0,0,0,0,0,0,0,0,0,0,0,0,0,0,0,"42,726","40,138","45,359","52,562",0,0,0,0,0,0,0,0,0
Kenya,Domestic General Government Expenditure on General outpatient curative care,Million NCU,0,0,0,0,0,0,0,0,0,0,0,0,0,0,0,0,"42,726","40,138","45,359","52,555",0,0,0,0,0,0,0,0,0
Kenya,Domestic General Government Expenditure on Outpatient curative care n.e.c.,Million NCU,0,0,0,0,0,0,0,0,0,0,0,0,0,0,0,0,0,0,0,7,0,0,0,0,0,0,0,0,0
Kenya,Domestic General Government Expenditure on Rehabilitative care,Million NCU,0,0,0,0,0,0,0,0,0,0,0,0,0,0,0,0,1,1,0,1,0,0,0,0,0,0,0,0,0
Kenya,Domestic General Government Expenditure on Medical goods (non-specified by function),Million NCU,0,0,0,0,0,0,0,0,0,0,0,0,0,0,0,0,8,7,0,48,0,0,0,0,0,0,0,0,0
Kenya,Domestic General Government Expenditure on Pharmaceuticals and Other medical durable goods,Million NCU,0,0,0,0,0,0,0,0,0,0,0,0,0,0,0,0,8,7,0,48,0,0,0,0,0,0,0,0,0
Kenya,Domestic General Government Expenditure on Unspecified medical goods (n.e.c.),Million NCU,0,0,0,0,0,0,0,0,0,0,0,0,0,0,0,0,0,0,0,0,0,0,0,0,0,0,0,0,0
Kenya,Domestic General Government Expenditure on Preventive care,Million NCU,0,0,0,0,0,0,0,0,0,0,0,0,0,0,0,0,"18,306","17,197","18,587","21,184",0,0,0,0,0,0,0,0,0
Kenya,"Domestic General Government Expenditure on Information, education and counseling (IEC) programmes",Million NCU,0,0,0,0,0,0,0,0,0,0,0,0,0,0,0,0,50,47,9,199,0,0,0,0,0,0,0,0,0
Kenya,Domestic General Government Expenditure on Immunization Programmes,Million NCU,0,0,0,0,0,0,0,0,0,0,0,0,0,0,0,0,256,241,290,289,0,0,0,0,0,0,0,0,0
Kenya,Domestic General Government Expenditure on Early disease detection programmes,Million NCU,0,0,0,0,0,0,0,0,0,0,0,0,0,0,0,0,5,5,0,5,0,0,0,0,0,0,0,0,0
Kenya,Domestic General Government Expenditure on Healthy condition monitoring programmes,Million NCU,0,0,0,0,0,0,0,0,0,0,0,0,0,0,0,0,"12,631","11,866","14,337","16,875",0,0,0,0,0,0,0,0,0
Kenya,Domestic General Government Expenditure on Epidemiological surveillance and risk and disease control programmes,Million NCU,0,0,0,0,0,0,0,0,0,0,0,0,0,0,0,0,532,500,"1,803",135,0,0,0,0,0,0,0,0,0
Kenya,Domestic General Government Expenditure on Preparing for disaster and emergency response programmes,Million NCU,0,0,0,0,0,0,0,0,0,0,0,0,0,0,0,0,"1,911","1,796",0,0,0,0,0,0,0,0,0,0,0
Kenya,Domestic General Government Expenditure on Unspecified preventive care (n.e.c.),Million NCU,0,0,0,0,0,0,0,0,0,0,0,0,0,0,0,0,"2,920","2,743","2,148","3,682",0,0,0,0,0,0,0,0,0
Kenya,"Domestic General Government Expenditure on Governance, health system & financing administration",Million NCU,0,0,0,0,0,0,0,0,0,0,0,0,0,0,0,0,"36,634","34,415","34,965","41,865",0,0,0,0,0,0,0,0,0
Kenya,Domestic General Government Expenditure on Governance and Health system administration,Million NCU,0,0,0,0,0,0,0,0,0,0,0,0,0,0,0,0,0,0,388,"1,219",0,0,0,0,0,0,0,0,0
Kenya,Domestic General Government Expenditure on Administration of health financing,Million NCU,0,0,0,0,0,0,0,0,0,0,0,0,0,0,0,0,"36,634","34,415","34,577","40,646",0,0,0,0,0,0,0,0,0
Kenya,"Domestic General Government Expenditure on Unspecified governance, and health system and financing administration (n.e.c.)",Million NCU,0,0,0,0,0,0,0,0,0,0,0,0,0,0,0,0,0,0,0,0,0,0,0,0,0,0,0,0,0
Kenya,Domestic General Government Expenditure on Other health care services (n.e.c.),Million NCU,0,0,0,0,0,0,0,0,0,0,0,0,0,0,0,0,0,0,"5,488","6,865",0,0,0,0,0,0,0,0,0
Kenya,External health expenditure by Health Care Functions,Million NCU,0,0,0,0,0,0,0,0,0,0,0,0,0,0,0,0,"58,511","71,304","84,823","82,788",0,0,0,0,0,0,0,0,0
Kenya,External Expenditure on Curative care,Million NCU,0,0,0,0,0,0,0,0,0,0,0,0,0,0,0,0,"29,555","36,017","29,953","26,609",0,0,0,0,0,0,0,0,0
Kenya,External Expenditure on Inpatient curative care,Million NCU,0,0,0,0,0,0,0,0,0,0,0,0,0,0,0,0,222,271,375,"1,701",0,0,0,0,0,0,0,0,0
Kenya,External Expenditure on Day curative care,Million NCU,0,0,0,0,0,0,0,0,0,0,0,0,0,0,0,0,0,0,"3,356",0,0,0,0,0,0,0,0,0,0
Kenya,External Expenditure on Outpatient curative care,Million NCU,0,0,0,0,0,0,0,0,0,0,0,0,0,0,0,0,"29,238","35,631","26,159","24,018",0,0,0,0,0,0,0,0,0
Kenya,External Expenditure on General outpatient curative care,Million NCU,0,0,0,0,0,0,0,0,0,0,0,0,0,0,0,0,"29,152","35,525","26,100","23,274",0,0,0,0,0,0,0,0,0
Kenya,External Expenditure on Dental outpatient curative care,Million NCU,0,0,0,0,0,0,0,0,0,0,0,0,0,0,0,0,0,0,0,13,0,0,0,0,0,0,0,0,0
Kenya,External Expenditure on Specialised outpatient curative care,Million NCU,0,0,0,0,0,0,0,0,0,0,0,0,0,0,0,0,87,106,59,730,0,0,0,0,0,0,0,0,0
Kenya,External Expenditure on Home-based curative care,Million NCU,0,0,0,0,0,0,0,0,0,0,0,0,0,0,0,0,94,115,64,890,0,0,0,0,0,0,0,0,0
Kenya,External Expenditure on Rehabilitative care,Million NCU,0,0,0,0,0,0,0,0,0,0,0,0,0,0,0,0,328,400,183,17,0,0,0,0,0,0,0,0,0
Kenya,External Expenditure on Ancillary services (non-specified by function),Million NCU,0,0,0,0,0,0,0,0,0,0,0,0,0,0,0,0,247,301,584,590,0,0,0,0,0,0,0,0,0
Kenya,External Expenditure on Medical goods (non-specified by function),Million NCU,0,0,0,0,0,0,0,0,0,0,0,0,0,0,0,0,4,4,11,0,0,0,0,0,0,0,0,0,0
Kenya,External Expenditure on Pharmaceuticals and Other medical durable goods,Million NCU,0,0,0,0,0,0,0,0,0,0,0,0,0,0,0,0,0,0,11,0,0,0,0,0,0,0,0,0,0
Kenya,External Expenditure on Unspecified medical goods (n.e.c.),Million NCU,0,0,0,0,0,0,0,0,0,0,0,0,0,0,0,0,4,4,0,0,0,0,0,0,0,0,0,0,0
Kenya,External Expenditure on Preventive care,Million NCU,0,0,0,0,0,0,0,0,0,0,0,0,0,0,0,0,"25,015","30,484","50,007","49,500",0,0,0,0,0,0,0,0,0
Kenya,"External Expenditure on Information, education and counseling (IEC) programmes",Million NCU,0,0,0,0,0,0,0,0,0,0,0,0,0,0,0,0,"8,006","9,757","14,200","16,634",0,0,0,0,0,0,0,0,0
Kenya,External sources of funding on Immunization Programmes ,Million NCU,0,0,0,0,0,0,0,0,0,0,0,0,0,0,0,0,835,"1,018","2,632","2,707",0,0,0,0,0,0,0,0,0
Kenya,External Expenditure on Early disease detection programmes,Million NCU,0,0,0,0,0,0,0,0,0,0,0,0,0,0,0,0,78,95,93,71,0,0,0,0,0,0,0,0,0
